[
  {
    "breakdown_id": "BREAKDOWN-BIO-001-A",
    "description": "[Tier 3 possible failure] Matches the wrong column or supplies a general association instead of addressing the description. [sources: biology_2023_internal_paper1_july_q1.1.row1, biology_2023_internal_paper1_july_q1.1.row2, biology_2023_internal_paper1_july_q1.1.row3, biology_2023_internal_paper1_july_q1.1.row4, biology_2023_internal_paper1_july_q1.1.row5, biology_2023_internal_paper1_july_q1.1.row6, biology_2023_internal_paper1_july_q1.1.row7, biology_2023_internal_paper1_july_q1.1.row8, biology_2023_internal_paper1_july_q1.1.row9, biology_2023_internal_paper1_july_q1.1.row10, biology_2023_internal_class_test_october_q1.row1, biology_2023_internal_class_test_october_q1.row2, biology_2023_internal_class_test_october_q1.row3, biology_2023_internal_class_test_october_q1.row4, biology_2023_internal_class_test_october_q1.row5, biology_2023_internal_class_test_october_q1.row6, biology_2023_internal_class_test_october_q1.row7, biology_2023_internal_class_test_october_q1.row8, biology_2023_internal_class_test_october_q1.row9, biology_2023_internal_class_test_october_q1.row10, biology_2023_internal_paper1_july_q1.3.1, biology_2023_internal_class_test_october_q3.1.1]",
    "parent_understanding_model": "UNDERSTANDING-BIO-001",
    "stage": "interpretation",
    "observable_signals": [
      "Can discuss the term but does not connect it to the specified clue. [sources: biology_2023_internal_paper1_july_q1.1.row1, biology_2023_internal_paper1_july_q1.1.row2, biology_2023_internal_paper1_july_q1.1.row3, biology_2023_internal_paper1_july_q1.1.row4, biology_2023_internal_paper1_july_q1.1.row5, biology_2023_internal_paper1_july_q1.1.row6, biology_2023_internal_paper1_july_q1.1.row7, biology_2023_internal_paper1_july_q1.1.row8, biology_2023_internal_paper1_july_q1.1.row9, biology_2023_internal_paper1_july_q1.1.row10, biology_2023_internal_class_test_october_q1.row1, biology_2023_internal_class_test_october_q1.row2, biology_2023_internal_class_test_october_q1.row3, biology_2023_internal_class_test_october_q1.row4, biology_2023_internal_class_test_october_q1.row5, biology_2023_internal_class_test_october_q1.row6, biology_2023_internal_class_test_october_q1.row7, biology_2023_internal_class_test_october_q1.row8, biology_2023_internal_class_test_october_q1.row9, biology_2023_internal_class_test_october_q1.row10, biology_2023_internal_paper1_july_q1.3.1, biology_2023_internal_class_test_october_q3.1.1]"
    ],
    "possible_confusions": [
      "Does not distinguish the biological meanings needed for the match. [sources: biology_2023_internal_paper1_july_q1.1.row1, biology_2023_internal_paper1_july_q1.1.row2, biology_2023_internal_paper1_july_q1.1.row3, biology_2023_internal_paper1_july_q1.1.row4, biology_2023_internal_paper1_july_q1.1.row5, biology_2023_internal_paper1_july_q1.1.row6, biology_2023_internal_paper1_july_q1.1.row7, biology_2023_internal_paper1_july_q1.1.row8, biology_2023_internal_paper1_july_q1.1.row9, biology_2023_internal_paper1_july_q1.1.row10, biology_2023_internal_class_test_october_q1.row1, biology_2023_internal_class_test_october_q1.row2, biology_2023_internal_class_test_october_q1.row3, biology_2023_internal_class_test_october_q1.row4, biology_2023_internal_class_test_october_q1.row5, biology_2023_internal_class_test_october_q1.row6, biology_2023_internal_class_test_october_q1.row7, biology_2023_internal_class_test_october_q1.row8, biology_2023_internal_class_test_october_q1.row9, biology_2023_internal_class_test_october_q1.row10, biology_2023_internal_paper1_july_q1.3.1, biology_2023_internal_class_test_october_q3.1.1]"
    ],
    "distinguishing_questions": [
      "DIAG-BIO-001-A",
      "DIAG-BIO-001-B"
    ],
    "source_basis": [
      "biology_2023_internal_paper1_july_q1.1.row1",
      "biology_2023_internal_paper1_july_q1.1.row2",
      "biology_2023_internal_paper1_july_q1.1.row3",
      "biology_2023_internal_paper1_july_q1.1.row4",
      "biology_2023_internal_paper1_july_q1.1.row5",
      "biology_2023_internal_paper1_july_q1.1.row6",
      "biology_2023_internal_paper1_july_q1.1.row7",
      "biology_2023_internal_paper1_july_q1.1.row8",
      "biology_2023_internal_paper1_july_q1.1.row9",
      "biology_2023_internal_paper1_july_q1.1.row10",
      "biology_2023_internal_class_test_october_q1.row1",
      "biology_2023_internal_class_test_october_q1.row2",
      "biology_2023_internal_class_test_october_q1.row3",
      "biology_2023_internal_class_test_october_q1.row4",
      "biology_2023_internal_class_test_october_q1.row5",
      "biology_2023_internal_class_test_october_q1.row6",
      "biology_2023_internal_class_test_october_q1.row7",
      "biology_2023_internal_class_test_october_q1.row8",
      "biology_2023_internal_class_test_october_q1.row9",
      "biology_2023_internal_class_test_october_q1.row10",
      "biology_2023_internal_paper1_july_q1.3.1",
      "biology_2023_internal_class_test_october_q3.1.1"
    ],
    "confidence": "medium"
  },
  {
    "breakdown_id": "BREAKDOWN-BIO-001-B",
    "description": "[Tier 3 possible failure] Does not distinguish the biological meanings needed for the match. [sources: biology_2023_internal_paper1_july_q1.1.row1, biology_2023_internal_paper1_july_q1.1.row2, biology_2023_internal_paper1_july_q1.1.row3, biology_2023_internal_paper1_july_q1.1.row4, biology_2023_internal_paper1_july_q1.1.row5, biology_2023_internal_paper1_july_q1.1.row6, biology_2023_internal_paper1_july_q1.1.row7, biology_2023_internal_paper1_july_q1.1.row8, biology_2023_internal_paper1_july_q1.1.row9, biology_2023_internal_paper1_july_q1.1.row10, biology_2023_internal_class_test_october_q1.row1, biology_2023_internal_class_test_october_q1.row2, biology_2023_internal_class_test_october_q1.row3, biology_2023_internal_class_test_october_q1.row4, biology_2023_internal_class_test_october_q1.row5, biology_2023_internal_class_test_october_q1.row6, biology_2023_internal_class_test_october_q1.row7, biology_2023_internal_class_test_october_q1.row8, biology_2023_internal_class_test_october_q1.row9, biology_2023_internal_class_test_october_q1.row10, biology_2023_internal_paper1_july_q1.3.1, biology_2023_internal_class_test_october_q3.1.1]",
    "parent_understanding_model": "UNDERSTANDING-BIO-001",
    "stage": "prerequisite",
    "observable_signals": [
      "Uses several candidate terms as synonyms even after identifying the clue. [sources: biology_2023_internal_paper1_july_q1.1.row1, biology_2023_internal_paper1_july_q1.1.row2, biology_2023_internal_paper1_july_q1.1.row3, biology_2023_internal_paper1_july_q1.1.row4, biology_2023_internal_paper1_july_q1.1.row5, biology_2023_internal_paper1_july_q1.1.row6, biology_2023_internal_paper1_july_q1.1.row7, biology_2023_internal_paper1_july_q1.1.row8, biology_2023_internal_paper1_july_q1.1.row9, biology_2023_internal_paper1_july_q1.1.row10, biology_2023_internal_class_test_october_q1.row1, biology_2023_internal_class_test_october_q1.row2, biology_2023_internal_class_test_october_q1.row3, biology_2023_internal_class_test_october_q1.row4, biology_2023_internal_class_test_october_q1.row5, biology_2023_internal_class_test_october_q1.row6, biology_2023_internal_class_test_october_q1.row7, biology_2023_internal_class_test_october_q1.row8, biology_2023_internal_class_test_october_q1.row9, biology_2023_internal_class_test_october_q1.row10, biology_2023_internal_paper1_july_q1.3.1, biology_2023_internal_class_test_october_q3.1.1]"
    ],
    "possible_confusions": [
      "Matches the wrong column or supplies a general association instead of addressing the description. [sources: biology_2023_internal_paper1_july_q1.1.row1, biology_2023_internal_paper1_july_q1.1.row2, biology_2023_internal_paper1_july_q1.1.row3, biology_2023_internal_paper1_july_q1.1.row4, biology_2023_internal_paper1_july_q1.1.row5, biology_2023_internal_paper1_july_q1.1.row6, biology_2023_internal_paper1_july_q1.1.row7, biology_2023_internal_paper1_july_q1.1.row8, biology_2023_internal_paper1_july_q1.1.row9, biology_2023_internal_paper1_july_q1.1.row10, biology_2023_internal_class_test_october_q1.row1, biology_2023_internal_class_test_october_q1.row2, biology_2023_internal_class_test_october_q1.row3, biology_2023_internal_class_test_october_q1.row4, biology_2023_internal_class_test_october_q1.row5, biology_2023_internal_class_test_october_q1.row6, biology_2023_internal_class_test_october_q1.row7, biology_2023_internal_class_test_october_q1.row8, biology_2023_internal_class_test_october_q1.row9, biology_2023_internal_class_test_october_q1.row10, biology_2023_internal_paper1_july_q1.3.1, biology_2023_internal_class_test_october_q3.1.1]"
    ],
    "distinguishing_questions": [
      "DIAG-BIO-001-A",
      "DIAG-BIO-001-B"
    ],
    "source_basis": [
      "biology_2023_internal_paper1_july_q1.1.row1",
      "biology_2023_internal_paper1_july_q1.1.row2",
      "biology_2023_internal_paper1_july_q1.1.row3",
      "biology_2023_internal_paper1_july_q1.1.row4",
      "biology_2023_internal_paper1_july_q1.1.row5",
      "biology_2023_internal_paper1_july_q1.1.row6",
      "biology_2023_internal_paper1_july_q1.1.row7",
      "biology_2023_internal_paper1_july_q1.1.row8",
      "biology_2023_internal_paper1_july_q1.1.row9",
      "biology_2023_internal_paper1_july_q1.1.row10",
      "biology_2023_internal_class_test_october_q1.row1",
      "biology_2023_internal_class_test_october_q1.row2",
      "biology_2023_internal_class_test_october_q1.row3",
      "biology_2023_internal_class_test_october_q1.row4",
      "biology_2023_internal_class_test_october_q1.row5",
      "biology_2023_internal_class_test_october_q1.row6",
      "biology_2023_internal_class_test_october_q1.row7",
      "biology_2023_internal_class_test_october_q1.row8",
      "biology_2023_internal_class_test_october_q1.row9",
      "biology_2023_internal_class_test_october_q1.row10",
      "biology_2023_internal_paper1_july_q1.3.1",